{
  "schema_version": 1,
  "updated": "2026-08-01",
  "tradition_id": "chinese_bazi",
  "source_pack_id": "bazi_sexagenary_kernel_v1",
  "status": "research_only_fail_closed",
  "source_ids": [
    "chinese_hko_stems_branches",
    "chinese_hko_24_solar_terms_2027",
    "bazi_sanming_tonghui_wikisource"
  ],
  "vectors": [
    {
      "vector_id": "bazi.cycle.origin",
      "rule_ids": ["bazi.sexagenary.stem_cycle_10", "bazi.sexagenary.branch_cycle_12", "bazi.sexagenary.joint_cycle_60_parity"],
      "inputs": {"operation": "offset", "offset": 0},
      "expected": {"stem_id": "jia", "branch_id": "zi", "sexagenary_index": 0},
      "provenance": "HKO sexagenary table begins with Jia-Zi."
    },
    {
      "vector_id": "bazi.cycle.index_59",
      "rule_ids": ["bazi.sexagenary.joint_cycle_60_parity"],
      "inputs": {"operation": "offset", "offset": 59},
      "expected": {"stem_id": "gui", "branch_id": "hai", "sexagenary_index": 59},
      "provenance": "Last pair of the HKO sixty-pair cycle."
    },
    {
      "vector_id": "bazi.cycle.wrap_60",
      "rule_ids": ["bazi.sexagenary.joint_cycle_60_parity"],
      "inputs": {"operation": "offset", "offset": 60},
      "expected": {"stem_id": "jia", "branch_id": "zi", "sexagenary_index": 0},
      "provenance": "Sixty-position recurrence of the joint cycle."
    },
    {
      "vector_id": "bazi.cycle.negative_wrap",
      "rule_ids": ["bazi.sexagenary.joint_cycle_60_parity"],
      "inputs": {"operation": "offset", "offset": -1},
      "expected": {"stem_id": "gui", "branch_id": "hai", "sexagenary_index": 59},
      "provenance": "Modular inverse boundary fixture; no historical epoch is implied."
    },
    {
      "vector_id": "bazi.cycle.parity_reject",
      "rule_ids": ["bazi.sexagenary.joint_cycle_60_parity"],
      "inputs": {"operation": "pair_check", "stem_id": "jia", "branch_id": "chou"},
      "expected": {"valid_pair": false, "reason": "cross_parity_pair_never_occurs"},
      "provenance": "Jia-Chou is one of the sixty combinatorial pairs absent from the HKO cycle table."
    },
    {
      "vector_id": "bazi.stem.wrap_10",
      "rule_ids": ["bazi.sexagenary.stem_cycle_10"],
      "inputs": {"operation": "stem_offset", "offset": 10},
      "expected": {"stem_id": "jia"},
      "provenance": "Ten-stem recurrence from the HKO stems table."
    },
    {
      "vector_id": "bazi.branch.wrap_12",
      "rule_ids": ["bazi.sexagenary.branch_cycle_12"],
      "inputs": {"operation": "branch_offset", "offset": 12},
      "expected": {"branch_id": "zi"},
      "provenance": "Twelve-branch recurrence from the HKO branches table."
    },
    {
      "vector_id": "bazi.shichen.zi_late",
      "rule_ids": ["bazi.sexagenary.shichen_partition"],
      "inputs": {"operation": "shichen", "time_of_day": "23:30"},
      "expected": {"shichen_branch_id": "zi"},
      "provenance": "HKO assigns Zi from 23:00 through 01:00; 23:30 falls in Zi."
    },
    {
      "vector_id": "bazi.shichen.zi_early",
      "rule_ids": ["bazi.sexagenary.shichen_partition"],
      "inputs": {"operation": "shichen", "time_of_day": "00:30"},
      "expected": {"shichen_branch_id": "zi"},
      "provenance": "HKO assigns Zi from 23:00 through 01:00; 00:30 falls in Zi."
    },
    {
      "vector_id": "bazi.shichen.chou_boundary",
      "rule_ids": ["bazi.sexagenary.shichen_partition"],
      "inputs": {"operation": "shichen", "time_of_day": "01:00"},
      "expected": {"shichen_branch_id": "chou"},
      "provenance": "Chou begins at 01:00 in the HKO shichen table."
    },
    {
      "vector_id": "bazi.shichen.noon",
      "rule_ids": ["bazi.sexagenary.shichen_partition"],
      "inputs": {"operation": "shichen", "time_of_day": "12:30"},
      "expected": {"shichen_branch_id": "wu_branch"},
      "provenance": "Wu spans 11:00 through 13:00 in the HKO shichen table."
    },
    {
      "vector_id": "bazi.month_stem.jia_year",
      "rule_ids": ["bazi.sexagenary.month_stem_from_year_stem"],
      "inputs": {"operation": "first_month_stem", "year_stem_id": "jia"},
      "expected": {"first_month_stem_id": "bing"},
      "provenance": "First row of the HKO year-stem-to-month-stem table."
    },
    {
      "vector_id": "bazi.month_stem.bing_year",
      "rule_ids": ["bazi.sexagenary.month_stem_from_year_stem"],
      "inputs": {"operation": "first_month_stem", "year_stem_id": "bing"},
      "expected": {"first_month_stem_id": "geng"},
      "provenance": "Bing/Xin row of the HKO year-stem-to-month-stem table."
    },
    {
      "vector_id": "bazi.hour_stem.ren_day",
      "rule_ids": ["bazi.sexagenary.hour_stem_from_day_stem"],
      "inputs": {"operation": "zi_hour_stem", "day_stem_id": "ren"},
      "expected": {"zi_hour_stem_id": "geng"},
      "provenance": "Ding/Ren row of the HKO day-stem-to-hour-stem table."
    },
    {
      "vector_id": "bazi.hour_stem.wu_day",
      "rule_ids": ["bazi.sexagenary.hour_stem_from_day_stem"],
      "inputs": {"operation": "zi_hour_stem", "day_stem_id": "wu_stem"},
      "expected": {"zi_hour_stem_id": "ren"},
      "provenance": "Wu/Gui row of the HKO day-stem-to-hour-stem table."
    },
    {
      "vector_id": "bazi.solar_terms.structure",
      "rule_ids": ["bazi.solar_terms.24_longitude_moments"],
      "inputs": {"operation": "solar_term_structure"},
      "expected": {"term_count": 24, "major_terms": 12, "minor_terms": 12, "per_term_longitudes_encoded": false},
      "provenance": "HKO 2027 table: 24 predefined ecliptic-longitude moments, twelve major and twelve minor."
    },
    {
      "vector_id": "bazi.anchor.fixture_forward",
      "rule_ids": ["bazi.sexagenary.named_anchor_required"],
      "inputs": {
        "operation": "civil_date",
        "civil_date": "2000-03-02",
        "anchor": {"anchor_id": "test_fixture_not_historical", "tradition_id": "chinese_bazi", "anchor_civil_date": "2000-01-01", "calendar_policy": "proleptic_gregorian_test_fixture", "anchor_sexagenary_index": 0, "authority": "arithmetic_validation_only", "uncertainty": "not_a_historical_concordance", "day_start": "civil_midnight_test_fixture"}
      },
      "expected": {"stem_id": "yi", "branch_id": "chou", "sexagenary_index": 1, "day_offset": 61},
      "provenance": "Synthetic anchor explicitly labeled a test fixture; validates date subtraction and modular advance without claiming a historical day concordance."
    },
    {
      "vector_id": "bazi.anchor.missing_rejected",
      "rule_ids": ["bazi.sexagenary.named_anchor_required"],
      "inputs": {"operation": "civil_date", "civil_date": "2000-03-02"},
      "expected": {"rejected": true, "reason": "no_named_anchor_profile"},
      "provenance": "Fail-closed control: civil-date conversion without a named anchor profile is refused."
    },
    {
      "vector_id": "bazi.convention.missing_rejected",
      "rule_ids": ["bazi.sexagenary.named_convention_profile_required"],
      "inputs": {"operation": "pillar_boundary_assignment", "boundary": "year"},
      "expected": {"rejected": true, "reason": "no_named_convention_profile"},
      "provenance": "Fail-closed control: boundary-dependent pillar assignment without a named school convention profile is refused."
    },
    {
      "vector_id": "bazi.interpretation.suppressed",
      "rule_ids": ["bazi.sexagenary.arithmetic_has_no_interpretation"],
      "inputs": {"operation": "offset", "offset": 0, "request_interpretation": true},
      "expected": {"emit_interpretation": false, "forbidden_fields_absent": true},
      "provenance": "Kernel output contract forbids five-element tallies, Ten Gods, luck pillars, and readings."
    }
  ]
}
